"Status","Start Time","Stop Time","Duration in ms","Parent Suite","Suite","Sub Suite","Test Class","Test Method","Name","Description"
"passed","Tue Jan 25 18:08:53 GMT 2022","Tue Jan 25 18:08:54 GMT 2022","1164","Test Suite","UI Tests","com.ita.edu.teachua.ui.tests.BasicSearchTest","com.ita.edu.teachua.ui.tests.BasicSearchTest","checkInvalidSymbolsAndQuantityPaste","TUA-428","Verify search field behavior for invalid number of symbols pasted"
"passed","Tue Jan 25 17:57:29 GMT 2022","Tue Jan 25 17:57:30 GMT 2022","1043","Test Suite","API Tests","com.ita.edu.teachua.api.tests.FeedbackTest","com.ita.edu.teachua.api.tests.FeedbackTest","createFeedbackWithEmptyTextFiledTest","TUA-370","[API] Verify that feedback without text is not added to the club"
"passed","Tue Jan 25 18:10:10 GMT 2022","Tue Jan 25 18:10:11 GMT 2022","1457","Test Suite","UI Tests","com.ita.edu.teachua.ui.tests.BasicSearchTest","com.ita.edu.teachua.ui.tests.BasicSearchTest","checkSearchWithNameOfClubsTyping","TUA-226","TUA-226 Verify that user can perform basic search by typing name of a club"
"passed","Tue Jan 25 17:57:58 GMT 2022","Tue Jan 25 17:58:10 GMT 2022","11879","Test Suite","BDD Tests","com.ita.edu.teachua.cucumber.cucumberTestRunner.CucumberTestRunner","com.ita.edu.teachua.cucumber.cucumberTestRunner.CucumberTestRunner","scenario","Example of BDD suite",""
"passed","Tue Jan 25 17:57:16 GMT 2022","Tue Jan 25 17:57:17 GMT 2022","640","Test Suite","UI Tests","com.ita.edu.teachua.ui.tests.AdvancedSearchTest","com.ita.edu.teachua.ui.tests.AdvancedSearchTest","checkByValidAgeDataProvider","TUA-210","TUA-210 Verify that input field 'Вік дитини' accepts only positive integers from 2 to 18"
"passed","Tue Jan 25 17:56:39 GMT 2022","Tue Jan 25 17:56:41 GMT 2022","1990","Test Suite","API Tests","com.ita.edu.teachua.api.tests.RegistrationTest","com.ita.edu.teachua.api.tests.RegistrationTest","testRegisterWithAllEmptyFields","TUA-420","TUA-420 [API.Реєстрація] Verify that a user with empty mandatory fields can`t be created"
"passed","Tue Jan 25 18:09:49 GMT 2022","Tue Jan 25 18:09:50 GMT 2022","1209","Test Suite","UI Tests","com.ita.edu.teachua.ui.tests.BasicSearchTest","com.ita.edu.teachua.ui.tests.BasicSearchTest","checkSearchWithNameOfClubsClipBoard","TUA-226","TUA-226 Verify that user can perform basic search by inserting name of a club"
"passed","Tue Jan 25 17:58:19 GMT 2022","Tue Jan 25 17:58:20 GMT 2022","803","Test Suite","API Tests","com.ita.edu.teachua.api.tests.QuestionTest","com.ita.edu.teachua.api.tests.QuestionTest","getQuestionByIdTest","TUA","[API] Get FAQ by id"
"passed","Tue Jan 25 17:57:02 GMT 2022","Tue Jan 25 17:57:05 GMT 2022","2419","Test Suite","API Tests","com.ita.edu.teachua.api.tests.AboutUsTest","com.ita.edu.teachua.api.tests.AboutUsTest","createChangeAndDeleteAboutUs","Create, change and delete About Us by ID","[API] Create, change and delete About Us by ID"
"passed","Tue Jan 25 17:58:54 GMT 2022","Tue Jan 25 17:58:58 GMT 2022","3756","Test Suite","API Tests","com.ita.edu.teachua.api.tests.ChallengeTest","com.ita.edu.teachua.api.tests.ChallengeTest","addChallengeTestWithValidData","TUA-429/432/435",""
"passed","Tue Jan 25 18:09:29 GMT 2022","Tue Jan 25 18:09:30 GMT 2022","1198","Test Suite","UI Tests","com.ita.edu.teachua.ui.tests.BasicSearchTest","com.ita.edu.teachua.ui.tests.BasicSearchTest","checkSearchWithNameOfClubsClipBoard","TUA-226","TUA-226 Verify that user can perform basic search by inserting name of a club"
"passed","Tue Jan 25 17:58:32 GMT 2022","Tue Jan 25 17:58:35 GMT 2022","2715","Test Suite","API Tests","com.ita.edu.teachua.api.tests.UserTest","com.ita.edu.teachua.api.tests.UserTest","testUserCanEditRole","TUA-416","TUA-416 [API. Edit profile] The user or manager can change their role"
"passed","Tue Jan 25 18:10:15 GMT 2022","Tue Jan 25 18:10:16 GMT 2022","1383","Test Suite","UI Tests","com.ita.edu.teachua.ui.tests.BasicSearchTest","com.ita.edu.teachua.ui.tests.BasicSearchTest","checkSearchWithNameOfClubsTyping","TUA-226","TUA-226 Verify that user can perform basic search by typing name of a club"
"passed","Tue Jan 25 17:58:58 GMT 2022","Tue Jan 25 17:58:59 GMT 2022","658","Test Suite","API Tests","com.ita.edu.teachua.api.tests.ChallengeTest","com.ita.edu.teachua.api.tests.ChallengeTest","isNotAbleToCreateChallengeWithInvalidValues","TUA-430/431/433/434",""
"passed","Tue Jan 25 17:58:31 GMT 2022","Tue Jan 25 17:58:32 GMT 2022","1354","Test Suite","API Tests","com.ita.edu.teachua.api.tests.UserTest","com.ita.edu.teachua.api.tests.UserTest","testUserCanEditProfile","TUA-408","TUA-408 [API] User can edit profile with valid data"
"broken","Tue Jan 25 17:56:53 GMT 2022","Tue Jan 25 17:57:02 GMT 2022","9751","Test Suite","BDD Tests","com.ita.edu.teachua.cucumber.cucumberTestRunner.CucumberTestRunner","com.ita.edu.teachua.cucumber.cucumberTestRunner.CucumberTestRunner","runScenario","Runs Cucumber Scenarios",""
"passed","Tue Jan 25 17:57:44 GMT 2022","Tue Jan 25 17:57:46 GMT 2022","1458","Test Suite","API Tests","com.ita.edu.teachua.api.tests.AuthorizedClubTest","com.ita.edu.teachua.api.tests.AuthorizedClubTest","VerifyThatUserAsOwnerCanCreateNewClubWhichRegisteredOnHim","TUA-371/372/463","This test case verify that user as ""Керiвник гуртка"" can create new club with valid data"
"passed","Tue Jan 25 17:58:18 GMT 2022","Tue Jan 25 17:58:18 GMT 2022","724","Test Suite","API Tests","com.ita.edu.teachua.api.tests.StationTests","com.ita.edu.teachua.api.tests.StationTests","getStationsByName","Get station by name","[API] Get station by name"
"passed","Tue Jan 25 18:03:55 GMT 2022","Tue Jan 25 18:04:02 GMT 2022","7642","Test Suite","UI Tests","com.ita.edu.teachua.ui.tests.OwnerProfileTest","com.ita.edu.teachua.ui.tests.OwnerProfileTest","VerifyThatOwnerCannotAddLocationToTheListOfLocationsAfterLeavingFieldsEmpty","TUA-160","This test case verifies that a 'Керівник' cannot add a location to the list of locations after leaving all mandatory and optional fields empty"
"passed","Tue Jan 25 17:56:33 GMT 2022","Tue Jan 25 17:56:53 GMT 2022","19812","Test Suite","BDD Tests","com.ita.edu.teachua.cucumber.cucumberTestRunner.CucumberTestRunner","com.ita.edu.teachua.cucumber.cucumberTestRunner.CucumberTestRunner","runScenario","Runs Cucumber Scenarios",""
"passed","Tue Jan 25 17:57:28 GMT 2022","Tue Jan 25 17:57:29 GMT 2022","952","Test Suite","API Tests","com.ita.edu.teachua.api.tests.FeedbackTest","com.ita.edu.teachua.api.tests.FeedbackTest","addFeedbackToClubTest","TUA-376","[API] Add feedback to the club"
"unknown","Tue Jan 25 17:56:32 GMT 2022","Tue Jan 25 17:56:32 GMT 2022","2","Test Suite","UI Tests","com.ita.edu.teachua.ui.tests.RestorePasswordViaGmailApiTest","com.ita.edu.teachua.ui.tests.RestorePasswordViaGmailApiTest","verifyErrorPasswordAndReenterPasswordNotEqualTest","TUA-322","TUA-322 Verify if error message is displayed if passwords in 'Введіть новий пароль', 'Введіть новий пароль повторно' are not equal"
"passed","Tue Jan 25 18:09:39 GMT 2022","Tue Jan 25 18:09:40 GMT 2022","1176","Test Suite","UI Tests","com.ita.edu.teachua.ui.tests.BasicSearchTest","com.ita.edu.teachua.ui.tests.BasicSearchTest","checkSearchWithNameOfClubsClipBoard","TUA-226","TUA-226 Verify that user can perform basic search by inserting name of a club"
"passed","Tue Jan 25 17:57:26 GMT 2022","Tue Jan 25 17:57:27 GMT 2022","993","Test Suite","API Tests","com.ita.edu.teachua.api.tests.CenterTests","com.ita.edu.teachua.api.tests.CenterTests","getListOfCentersById","get list of centers by id","[API]Test verifies if we can get list of centers by id"
"passed","Tue Jan 25 17:57:30 GMT 2022","Tue Jan 25 17:57:30 GMT 2022","719","Test Suite","API Tests","com.ita.edu.teachua.api.tests.FeedbackTest","com.ita.edu.teachua.api.tests.FeedbackTest","getFeedbackByIdTest","TUA","[API] Get feedback by id"
"passed","Tue Jan 25 17:57:37 GMT 2022","Tue Jan 25 17:58:34 GMT 2022","56678","Test Suite","UI Tests","com.ita.edu.teachua.ui.tests.AdvancedSearchTest","com.ita.edu.teachua.ui.tests.AdvancedSearchTest","checkSortingClubsByNameInAscendingOrder","TUA-103","Verify that sorting by name for advanced search works correctly (In ascending order)"
"passed","Tue Jan 25 18:06:46 GMT 2022","Tue Jan 25 18:07:23 GMT 2022","36957","Test Suite","UI Tests","com.ita.edu.teachua.ui.tests.OwnerProfileTest","com.ita.edu.teachua.ui.tests.OwnerProfileTest","checkErrorMsWhenFillInvalidDataIntoLastNameField","TUA-343","Verify that error messages are shown and 'Зберегти зміни' button becomes disabled while entering invalid data into the 'Прізвище' field"
"passed","Tue Jan 25 17:59:04 GMT 2022","Tue Jan 25 17:59:05 GMT 2022","984","Test Suite","API Tests","com.ita.edu.teachua.api.tests.CategoryTest","com.ita.edu.teachua.api.tests.CategoryTest","getListOfCategoriesSearch","[API category] Get list of all categories search with pagination","[API] Get list of all categories search with pagination"
"passed","Tue Jan 25 17:57:57 GMT 2022","Tue Jan 25 17:57:58 GMT 2022","657","Test Suite","API Tests","com.ita.edu.teachua.api.tests.BannerTest","com.ita.edu.teachua.api.tests.BannerTest","addNewBannerWithInvalidData","[API banner] add new banner with wrong path to picture","[API] add new banner with wrong path to picture"
"passed","Tue Jan 25 17:57:43 GMT 2022","Tue Jan 25 17:57:58 GMT 2022","15618","Test Suite","BDD Tests","com.ita.edu.teachua.cucumber.cucumberTestRunner.CucumberTestRunner","com.ita.edu.teachua.cucumber.cucumberTestRunner.CucumberTestRunner","scenario","Example of BDD suite",""
"passed","Tue Jan 25 18:04:06 GMT 2022","Tue Jan 25 18:04:16 GMT 2022","10177","Test Suite","UI Tests","com.ita.edu.teachua.ui.tests.OwnerProfileTest","com.ita.edu.teachua.ui.tests.OwnerProfileTest","addLocationWithValidDataOfMandatoryFields","TUA-159","Verify that a user can add location to the list of locations after filling in only mandatory fields with valid data"
"passed","Tue Jan 25 18:07:27 GMT 2022","Tue Jan 25 18:07:29 GMT 2022","2085","Test Suite","UI Tests","com.ita.edu.teachua.ui.tests.OwnerProfileTest","com.ita.edu.teachua.ui.tests.OwnerProfileTest","checkLastVerifyEnteredDataInRegistrationRemembered","TUA-454","This test check that last entered data on the ‘Реєстрація’ page are remembered #31"
"passed","Tue Jan 25 18:09:14 GMT 2022","Tue Jan 25 18:09:15 GMT 2022","1517","Test Suite","UI Tests","com.ita.edu.teachua.ui.tests.BasicSearchTest","com.ita.edu.teachua.ui.tests.BasicSearchTest","checkInvalidSymbolsAndQuantityTyping","TUA-428","Verify search field behavior for invalid number of symbols entered"
"passed","Tue Jan 25 18:04:48 GMT 2022","Tue Jan 25 18:05:23 GMT 2022","35543","Test Suite","UI Tests","com.ita.edu.teachua.ui.tests.OwnerProfileTest","com.ita.edu.teachua.ui.tests.OwnerProfileTest","checkDescriptionFieldWithLessAndMoreThan1500Symbols","TUA-177","TUA-177-Verify that error message ‘Опис гуртка може містити від 40 до 1500 символів.’ appears when the user enters more than 1500 symbols into the field or that field is valid when the user enters less than 1500 symbols"
"passed","Tue Jan 25 17:58:08 GMT 2022","Tue Jan 25 17:58:12 GMT 2022","4074","Test Suite","API Tests","com.ita.edu.teachua.api.tests.CityTest","com.ita.edu.teachua.api.tests.CityTest","changeLongitudeAndLatitudeOfCityTest","TUA","[API] Change the values of the longitude and latitude of the city"
"passed","Tue Jan 25 18:03:23 GMT 2022","Tue Jan 25 18:03:31 GMT 2022","7805","Test Suite","UI Tests","com.ita.edu.teachua.ui.tests.OwnerProfileTest","com.ita.edu.teachua.ui.tests.OwnerProfileTest","VerifyThatErrorMessagesIsDisplayedAfterUserLeavesFieldsEmptyAndClicksNextStepButton","TUA-252","This test case verifies that error messages is displayed after user leaves fields empty and clicks 'Наступний крок' button on 'Основна інформація' tab"
"passed","Tue Jan 25 17:59:03 GMT 2022","Tue Jan 25 17:59:03 GMT 2022","686","Test Suite","API Tests","com.ita.edu.teachua.api.tests.CategoryTest","com.ita.edu.teachua.api.tests.CategoryTest","getCategory","[API category] Get category by ID","[API] Get category by ID"
"passed","Tue Jan 25 17:57:32 GMT 2022","Tue Jan 25 17:57:33 GMT 2022","1023","Test Suite","UI Tests","com.ita.edu.teachua.ui.tests.AdvancedSearchTest","com.ita.edu.teachua.ui.tests.AdvancedSearchTest","checkIfCentersAreDisplayedAsAList","TUA-513","TUA-513-Verify that the centers in the results of advanced search can be displayed as a list"
"passed","Tue Jan 25 17:58:49 GMT 2022","Tue Jan 25 17:58:52 GMT 2022","2249","Test Suite","API Tests","com.ita.edu.teachua.api.tests.ContactTests","com.ita.edu.teachua.api.tests.ContactTests","getContact","Get contact by ID","[API] Get contact by ID"
"passed","Tue Jan 25 17:58:17 GMT 2022","Tue Jan 25 17:58:18 GMT 2022","707","Test Suite","API Tests","com.ita.edu.teachua.api.tests.StationTests","com.ita.edu.teachua.api.tests.StationTests","getStations","Get stations by name of the city","[API] Get station by the name of the city"
"passed","Tue Jan 25 17:57:13 GMT 2022","Tue Jan 25 17:57:16 GMT 2022","3631","Test Suite","API Tests","com.ita.edu.teachua.api.tests.CenterTests","com.ita.edu.teachua.api.tests.CenterTests","changeCenter","change center","API]Test verifies if we can update a center by id"
"passed","Tue Jan 25 18:07:33 GMT 2022","Tue Jan 25 18:07:43 GMT 2022","9932","Test Suite","UI Tests","com.ita.edu.teachua.ui.tests.OwnerProfileTest","com.ita.edu.teachua.ui.tests.OwnerProfileTest","getErrorMessageInChangePasswordPopUpTest","TUA-359","TUA-359 Verify that error messages are shown while leaving empty any field in the 'Змінити пароль' pop-up"
"passed","Tue Jan 25 17:58:35 GMT 2022","Tue Jan 25 17:58:39 GMT 2022","4055","Test Suite","API Tests","com.ita.edu.teachua.api.tests.UserTest","com.ita.edu.teachua.api.tests.UserTest","testUserCanNotEditProfileWithInvalidData","TUA-415","TUA-415 [API. Edit profile] Verify that user can not save changes with invalid data (fields lastName and firstName)"
"passed","Tue Jan 25 18:10:21 GMT 2022","Tue Jan 25 18:10:22 GMT 2022","1254","Test Suite","UI Tests","com.ita.edu.teachua.ui.tests.BasicSearchTest","com.ita.edu.teachua.ui.tests.BasicSearchTest","checkSearchWithNameOfClubsTyping","TUA-226","TUA-226 Verify that user can perform basic search by typing name of a club"
"broken","Tue Jan 25 17:58:33 GMT 2022","Tue Jan 25 17:58:43 GMT 2022","9284","Test Suite","BDD Tests","com.ita.edu.teachua.cucumber.cucumberTestRunner.CucumberTestRunner","com.ita.edu.teachua.cucumber.cucumberTestRunner.CucumberTestRunner","scenario","Example of BDD suite",""
"unknown","Tue Jan 25 17:56:32 GMT 2022","Tue Jan 25 17:56:32 GMT 2022","0","Test Suite","UI Tests","com.ita.edu.teachua.ui.tests.RestorePasswordViaGmailApiTest","com.ita.edu.teachua.ui.tests.RestorePasswordViaGmailApiTest","VerifyNewPasswordValidationWhenRestoringPasswordViaForgotPassword","TUA-318","This test case verifies that the user can recover or change the password, using valid values for 'New password' field."
"passed","Tue Jan 25 18:07:47 GMT 2022","Tue Jan 25 18:07:58 GMT 2022","10820","Test Suite","UI Tests","com.ita.edu.teachua.ui.tests.OwnerProfileTest","com.ita.edu.teachua.ui.tests.OwnerProfileTest","testAddLocationByOwner","TUA-158","Verify that a 'Керівник' can add location to the list of locations after filling in all mandatory and all optional fields with valid data"
"passed","Tue Jan 25 18:03:35 GMT 2022","Tue Jan 25 18:03:50 GMT 2022","15492","Test Suite","UI Tests","com.ita.edu.teachua.ui.tests.OwnerProfileTest","com.ita.edu.teachua.ui.tests.OwnerProfileTest","VerifyThatOwnerCanAddLocationOfClub","TUA-237","This test case verifies that a 'Керівник' can add a location of a club after filling in mandatory fields with valid data."
"passed","Tue Jan 25 17:58:25 GMT 2022","Tue Jan 25 17:58:33 GMT 2022","8051","Test Suite","BDD Tests","com.ita.edu.teachua.cucumber.cucumberTestRunner.CucumberTestRunner","com.ita.edu.teachua.cucumber.cucumberTestRunner.CucumberTestRunner","scenario","Example of BDD suite",""
"passed","Tue Jan 25 18:06:02 GMT 2022","Tue Jan 25 18:06:42 GMT 2022","40681","Test Suite","UI Tests","com.ita.edu.teachua.ui.tests.OwnerProfileTest","com.ita.edu.teachua.ui.tests.OwnerProfileTest","checkErrorMsWhenFillInvalidDataIntoFirstNameField","TUA-328","Verify that error messages are shown and 'Зберегти зміни' button becomes disabled while entering invalid data into the 'Ім'я' field"
"passed","Tue Jan 25 17:57:19 GMT 2022","Tue Jan 25 17:57:26 GMT 2022","6544","Test Suite","API Tests","com.ita.edu.teachua.api.tests.CenterTests","com.ita.edu.teachua.api.tests.CenterTests","getListOfCenters","get list of center","[API]Test verifies if we can get list of center"
"passed","Tue Jan 25 18:08:20 GMT 2022","Tue Jan 25 18:08:43 GMT 2022","23500","Test Suite","UI Tests","com.ita.edu.teachua.ui.tests.OwnerProfileTest","com.ita.edu.teachua.ui.tests.OwnerProfileTest","verifyThatErrorMessageAppearsWhenUserEntersLetterInRUSOrGER","TUA-178","This test case verifies that  error message appears when user enters letters in Russian or German languages into the field"
"passed","Tue Jan 25 17:56:32 GMT 2022","Tue Jan 25 17:56:39 GMT 2022","7546","Test Suite","API Tests","com.ita.edu.teachua.api.tests.ResetPasswordTest","com.ita.edu.teachua.api.tests.ResetPasswordTest","resetPasswordTest","resetPasswordTest",""
"passed","Tue Jan 25 17:57:56 GMT 2022","Tue Jan 25 17:57:57 GMT 2022","1319","Test Suite","API Tests","com.ita.edu.teachua.api.tests.BannerTest","com.ita.edu.teachua.api.tests.BannerTest","addNewBannerAndDeleteIt","[API banner] Add banner successfully and then delete it","[API] add new banner and delete it"
"unknown","Tue Jan 25 17:56:32 GMT 2022","Tue Jan 25 17:56:32 GMT 2022","0","Test Suite","UI Tests","com.ita.edu.teachua.ui.tests.RestorePasswordViaGmailApiTest","com.ita.edu.teachua.ui.tests.RestorePasswordViaGmailApiTest","testPasswordRecovery","TUA-321","Verify if error message is displayed after inputting invalid data for recover or change the password."
"passed","Tue Jan 25 17:57:46 GMT 2022","Tue Jan 25 17:57:53 GMT 2022","6815","Test Suite","API Tests","com.ita.edu.teachua.api.tests.AuthorizedClubTest","com.ita.edu.teachua.api.tests.AuthorizedClubTest","VerifyThatUserAsOwnerCanNotDeleteClubThatNotRegisteredByHim","TUA-498","This test case verifies that the User as ""Керiвник гуртка"" can not delete a club that was not registered by him"
"passed","Tue Jan 25 17:58:38 GMT 2022","Tue Jan 25 17:59:35 GMT 2022","56733","Test Suite","UI Tests","com.ita.edu.teachua.ui.tests.AdvancedSearchTest","com.ita.edu.teachua.ui.tests.AdvancedSearchTest","checkSortingClubsByNameInDescendingOrder","TUA-103","Verify that sorting by name for advanced search works correctly (In descending order)"
"passed","Tue Jan 25 17:56:50 GMT 2022","Tue Jan 25 17:56:51 GMT 2022","822","Test Suite","API Tests","com.ita.edu.teachua.api.tests.RegistrationTest","com.ita.edu.teachua.api.tests.RegistrationTest","testRegisterWithNonExistingRole","TUA-419","TUA-419 [API.Реєстрація] Verify that a user with non-existing role can`t be created"
"failed","Tue Jan 25 17:57:39 GMT 2022","Tue Jan 25 17:57:44 GMT 2022","5299","Test Suite","API Tests","com.ita.edu.teachua.api.tests.AuthorizedClubTest","com.ita.edu.teachua.api.tests.AuthorizedClubTest","VerifyThatClubCannotBeCreatedWhenOneOfTheMandatoryFieldsAreNotFilled","TUA-405","This test case verifies that user cannot create a club when one of the mandatory fields are not filled"
"passed","Tue Jan 25 18:02:11 GMT 2022","Tue Jan 25 18:02:12 GMT 2022","1167","Test Suite","UI Tests","com.ita.edu.teachua.ui.tests.AdvancedSearchTest","com.ita.edu.teachua.ui.tests.AdvancedSearchTest","verifyAllParametersActiveClubsAdvancedSearch","TUA-509","Verify that all parameters are activated with the selected 'Гурток' radio button"
"passed","Tue Jan 25 17:58:02 GMT 2022","Tue Jan 25 17:58:03 GMT 2022","1390","Test Suite","API Tests","com.ita.edu.teachua.api.tests.DistrictTest","com.ita.edu.teachua.api.tests.DistrictTest","createDistrict","createDistrict",""
"passed","Tue Jan 25 17:59:10 GMT 2022","Tue Jan 25 17:59:11 GMT 2022","649","Test Suite","API Tests","com.ita.edu.teachua.api.tests.RoleAdminTest","com.ita.edu.teachua.api.tests.RoleAdminTest","getRoleByIDTest","[API admin role] Get role by ID","[API] Get role by ID"
"broken","Tue Jan 25 17:56:42 GMT 2022","Tue Jan 25 17:56:53 GMT 2022","11445","Test Suite","UI Tests","com.ita.edu.teachua.ui.tests.RegistrationTest","com.ita.edu.teachua.ui.tests.RegistrationTest","checkAlertsFieldsWhenEmpty","TUA-483","TUA-483 Verify that error messages are shown for empty fields"
"passed","Tue Jan 25 17:57:21 GMT 2022","Tue Jan 25 17:57:23 GMT 2022","1711","Test Suite","UI Tests","com.ita.edu.teachua.ui.tests.AdvancedSearchTest","com.ita.edu.teachua.ui.tests.AdvancedSearchTest","checkByValidAgeDataProvider","TUA-210","TUA-210 Verify that input field 'Вік дитини' accepts only positive integers from 2 to 18"
"passed","Tue Jan 25 17:59:40 GMT 2022","Tue Jan 25 18:00:46 GMT 2022","66282","Test Suite","UI Tests","com.ita.edu.teachua.ui.tests.AdvancedSearchTest","com.ita.edu.teachua.ui.tests.AdvancedSearchTest","checkSortingClubsByRatingInAscendingOrder","TUA-103","Verify that sorting by rating for advanced search works correctly (In ascending order)"
"passed","Tue Jan 25 17:57:08 GMT 2022","Tue Jan 25 17:57:09 GMT 2022","1028","Test Suite","API Tests","com.ita.edu.teachua.api.tests.AboutUsTest","com.ita.edu.teachua.api.tests.AboutUsTest","getAllAboutUs","Get all About Us by ID","[API] Get all About Us by ID"
"passed","Tue Jan 25 17:59:07 GMT 2022","Tue Jan 25 17:59:09 GMT 2022","2346","Test Suite","API Tests","com.ita.edu.teachua.api.tests.RoleAdminTest","com.ita.edu.teachua.api.tests.RoleAdminTest","createNewRole","[API admin role] Create new role and delete it","[API] Create new role and delete it"
"passed","Tue Jan 25 17:59:09 GMT 2022","Tue Jan 25 17:59:10 GMT 2022","925","Test Suite","API Tests","com.ita.edu.teachua.api.tests.RoleAdminTest","com.ita.edu.teachua.api.tests.RoleAdminTest","getListOfRolesTest","[API admin role] Get list of all roles","[API] Get list of all roles"
"passed","Tue Jan 25 18:08:47 GMT 2022","Tue Jan 25 18:08:49 GMT 2022","1735","Test Suite","UI Tests","com.ita.edu.teachua.ui.tests.BasicSearchTest","com.ita.edu.teachua.ui.tests.BasicSearchTest","checkInvalidSymbolsAndQuantityPaste","TUA-428","Verify search field behavior for invalid number of symbols pasted"
"passed","Tue Jan 25 17:57:05 GMT 2022","Tue Jan 25 17:57:08 GMT 2022","3463","Test Suite","API Tests","com.ita.edu.teachua.api.tests.AboutUsTest","com.ita.edu.teachua.api.tests.AboutUsTest","getAboutUs","Get About Us by ID","[API] Get About Us by ID"
"passed","Tue Jan 25 18:09:24 GMT 2022","Tue Jan 25 18:09:25 GMT 2022","1186","Test Suite","UI Tests","com.ita.edu.teachua.ui.tests.BasicSearchTest","com.ita.edu.teachua.ui.tests.BasicSearchTest","checkSearchWithNameOfClubsClipBoard","TUA-226","TUA-226 Verify that user can perform basic search by inserting name of a club"
"passed","Tue Jan 25 18:01:52 GMT 2022","Tue Jan 25 18:02:02 GMT 2022","10231","Test Suite","UI Tests","com.ita.edu.teachua.ui.tests.AdvancedSearchTest","com.ita.edu.teachua.ui.tests.AdvancedSearchTest","openAdvancedSearchFieldTest","TUA-224","TUA-224 Advanced search button opens 'Розширений пошук' section"
"passed","Tue Jan 25 18:04:20 GMT 2022","Tue Jan 25 18:04:43 GMT 2022","22859","Test Suite","UI Tests","com.ita.edu.teachua.ui.tests.OwnerProfileTest","com.ita.edu.teachua.ui.tests.OwnerProfileTest","checkButtonIsEnabledWithValidInput","TUA-172","TUA-172-Verify that the ‘Опис’ text field is filled in with valid data when a user enters from 40 to 1500 symbols into the field"
"passed","Tue Jan 25 17:56:56 GMT 2022","Tue Jan 25 17:57:01 GMT 2022","5018","Test Suite","API Tests","com.ita.edu.teachua.api.tests.RegistrationTest","com.ita.edu.teachua.api.tests.RegistrationTest","testRegisterWithValidData","TUA-457","TUA-457 [API. Реєстрація] Verify that a user with valid data can be created"
"passed","Tue Jan 25 18:02:16 GMT 2022","Tue Jan 25 18:03:19 GMT 2022","63876","Test Suite","UI Tests","com.ita.edu.teachua.ui.tests.OwnerProfileTest","com.ita.edu.teachua.ui.tests.OwnerProfileTest","TestUserCheckInvalidDataForFieldPhone","TUA-356","Verify that error messages are shown and 'Зберегти зміни' button becomes disabled while entering invalid data for the 'Телефон' field"
"passed","Tue Jan 25 17:57:28 GMT 2022","Tue Jan 25 17:57:28 GMT 2022","598","Test Suite","UI Tests","com.ita.edu.teachua.ui.tests.AdvancedSearchTest","com.ita.edu.teachua.ui.tests.AdvancedSearchTest","checkByValidAgeDataProvider","TUA-210","TUA-210 Verify that input field 'Вік дитини' accepts only positive integers from 2 to 18"
"passed","Tue Jan 25 17:57:18 GMT 2022","Tue Jan 25 17:57:19 GMT 2022","874","Test Suite","API Tests","com.ita.edu.teachua.api.tests.CenterTests","com.ita.edu.teachua.api.tests.CenterTests","getCenter2","get center by id","[API]Test verifies if we can get a center by id"
"passed","Tue Jan 25 18:05:27 GMT 2022","Tue Jan 25 18:05:41 GMT 2022","13881","Test Suite","UI Tests","com.ita.edu.teachua.ui.tests.OwnerProfileTest","com.ita.edu.teachua.ui.tests.OwnerProfileTest","checkDescriptionFieldWithLessThan40Symbols","TUA-176","TUA-176-Verify that error message ‘Некоректний опис гуртка\n"" + ""Опис гуртка може містити від 40 до 1500 символів.’ appears when the user enters less than 40 symbols into the field"
